13:08:34.789295 IP 192.168.129.7.ssh > 192.168.129.56.58927: Flags [P.], seq 1622622443:1622622615, ack 3433108636, win 3533, options [nop,nop,TS val 204171198 ecr 2175090251], length 172
13:08:34.833946 IP 192.168.129.56.58927 > 192.168.129.7.ssh: Flags [.], ack 172, win 8286, options [nop,nop,TS val 2175090313 ecr 204171198], length 0
13:08:34.852208 IP 192.168.129.7.ssh > 192.168.129.56.58927: Flags [P.], seq 172:280, ack 1, win 3533, options [nop,nop,TS val 204171261 ecr 2175090313], length 108
13:08:34.896384 IP 192.168.129.56.58927 > 192.168.129.7.ssh: Flags [.], ack 280, win 8287, options [nop,nop,TS val 2175090376 ecr 204171261], length 0
13:08:34.923912 IP 192.168.129.7.ssh > 192.168.129.56.58927: Flags [P.], seq 280:396, ack 1, win 3533, options [nop,nop,TS val 204171333 ecr 2175090376], length 116
13:08:34.972198 IP 192.168.129.56.58927 > 192.168.129.7.ssh: Flags [P.], seq 1:117, ack 280, win 8289, options [nop,nop,TS val 2175090412 ecr 204171261], length 116
13:08:34.974273 IP 192.168.129.56.58927 > 192.168.129.7.ssh: Flags [.], ack 396, win 8289, options [nop,nop,TS val 2175090453 ecr 204171333], length 0
13:08:34.974414 IP 192.168.129.7.ssh > 192.168.129.56.58927: Flags [P.], seq 396:496, ack 117, win 3533, options [nop,nop,TS val 204171383 ecr 2175090412], length 100
13:08:34.975953 IP 192.168.129.56.58927 > 192.168.129.7.ssh: Flags [P.], seq 117:209, ack 396, win 8289, options [nop,nop,TS val 2175090455 ecr 204171333], length 92
13:08:34.977693 IP 192.168.129.7.ssh > 192.168.129.56.58927: Flags [P.], seq 496:596, ack 209, win 3533, options [nop,nop,TS val 204171387 ecr 2175090455], length 100
13:08:35.002191 IP 192.168.129.56.58927 > 192.168.129.7.ssh: Flags [P.], seq 209:309, ack 396, win 8289, options [nop,nop,TS val 2175090481 ecr 204171333], length 100
13:08:35.004952 IP 192.168.129.7.ssh > 192.168.129.56.58927: Flags [P.], seq 596:744, ack 309, win 3533, options [nop,nop,TS val 204171414 ecr 2175090481], length 148
13:08:35.018868 IP 192.168.129.56.58927 > 192.168.129.7.ssh: Flags [.], ack 496, win 8287, options [nop,nop,TS val 2175090498 ecr 204171383], length 0
13:08:35.021594 IP 192.168.129.56.58927 > 192.168.129.7.ssh: Flags [.], ack 596, win 8287, options [nop,nop,TS val 2175090501 ecr 204171387], length 0
13:08:35.086301 IP 192.168.129.56.58927 > 192.168.129.7.ssh: Flags [.], ack 744, win 8287, options [nop,nop,TS val 2175090566 ecr 204171414], length 0
13:08:35.088048 IP 192.168.129.56.58927 > 192.168.129.7.ssh: Flags [P.], seq 309:417, ack 744, win 8289, options [nop,nop,TS val 2175090568 ecr 204171414], length 108
13:08:35.093158 IP 192.168.129.7.ssh > 192.168.129.56.58927: Flags [P.], seq 744:1292, ack 417, win 3533, options [nop,nop,TS val 204171502 ecr 2175090568], length 548
13:08:35.138484 IP 192.168.129.56.58927 > 192.168.129.7.ssh: Flags [.], ack 1292, win 8280, options [nop,nop,TS val 2175090617 ecr 204171502], length 0
13:08:35.144124 IP 192.168.129.56.58927 > 192.168.129.7.ssh: Flags [P.], seq 417:525, ack 1292, win 8289, options [nop,nop,TS val 2175090624 ecr 204171502], length 108
13:08:35.146358 IP 192.168.129.7.ssh > 192.168.129.56.58927: Flags [P.], seq 1292:1416, ack 525, win 3533, options [nop,nop,TS val 204171555 ecr 2175090624], length 124
13:08:35.412545 IP 192.168.129.56.58927 > 192.168.129.7.ssh: Flags [P.], seq 417:525, ack 1292, win 8289, options [nop,nop,TS val 2175090876 ecr 204171502], length 108
13:08:35.412568 IP 192.168.129.7.ssh > 192.168.129.56.58927: Flags [.], ack 525, win 3533, options [nop,nop,TS val 204171821 ecr 2175090876,nop,nop,sack 1 {417:525}], length 0
13:08:35.414928 IP 192.168.129.56.58927 > 192.168.129.7.ssh: Flags [.], ack 1416, win 8287, options [nop,nop,TS val 2175090895 ecr 204171555], length 0
13:08:35.416794 IP 192.168.129.56.58927 > 192.168.129.7.ssh: Flags [P.], seq 525:633, ack 1416, win 8289, options [nop,nop,TS val 2175090897 ecr 204171555], length 108
13:08:35.416812 IP 192.168.129.7.ssh > 192.168.129.56.58927: Flags [.], ack 633, win 3533, options [nop,nop,TS val 204171826 ecr 2175090897], length 0
13:08:35.419452 IP 192.168.129.7.ssh > 192.168.129.56.58927: Flags [P.], seq 1416:1548, ack 633, win 3533, options [nop,nop,TS val 204171828 ecr 2175090897], length 132
13:08:35.451764 IP 192.168.129.7.ssh > 192.168.129.56.58927: Flags [P.], seq 1548:1640, ack 633, win 3533, options [nop,nop,TS val 204171861 ecr 2175090897], length 92
13:08:35.463768 IP 192.168.129.56.58927 > 192.168.129.7.ssh: Flags [.], ack 1548, win 8289, options [nop,nop,TS val 2175090943 ecr 204171828], length 0
13:08:35.478027 IP 192.168.129.56.58927 > 192.168.129.7.ssh: Flags [P.], seq 633:725, ack 1548, win 8289, options [nop,nop,TS val 2175090957 ecr 204171828], length 92
13:08:35.483170 IP 192.168.129.56.58927 > 192.168.129.7.ssh: Flags [P.], seq 725:817, ack 1548, win 8289, options [nop,nop,TS val 2175090962 ecr 204171828], length 92
13:08:35.483232 IP 192.168.129.7.ssh > 192.168.129.56.58927: Flags [.], ack 817, win 3533, options [nop,nop,TS val 204171892 ecr 2175090957], length 0
13:08:35.487190 IP 192.168.129.7.ssh > 192.168.129.56.58927: Flags [P.], seq 1640:1740, ack 817, win 3533, options [nop,nop,TS val 204171896 ecr 2175090957], length 100
13:08:35.497154 IP 192.168.129.56.58927 > 192.168.129.7.ssh: Flags [.], ack 1640, win 8289, options [nop,nop,TS val 2175090976 ecr 204171861], length 0
13:08:35.498746 IP 192.168.129.56.58927 > 192.168.129.7.ssh: Flags [P.], seq 817:909, ack 1640, win 8289, options [nop,nop,TS val 2175090978 ecr 204171861], length 92
13:08:35.501143 IP 192.168.129.7.ssh > 192.168.129.56.58927: Flags [P.], seq 1740:1840, ack 909, win 3533, options [nop,nop,TS val 204171910 ecr 2175090978], length 100
13:08:35.532732 IP 192.168.129.56.58927 > 192.168.129.7.ssh: Flags [.], ack 1740, win 8289, options [nop,nop,TS val 2175091013 ecr 204171896], length 0
13:08:35.535921 IP 192.168.129.56.58927 > 192.168.129.7.ssh: Flags [P.], seq 909:1001, ack 1740, win 8289, options [nop,nop,TS val 2175091015 ecr 204171896], length 92
13:08:35.545251 IP 192.168.129.56.58927 > 192.168.129.7.ssh: Flags [.], ack 1840, win 8287, options [nop,nop,TS val 2175091025 ecr 204171910], length 0
13:08:35.598585 IP 192.168.129.7.ssh > 192.168.129.56.58927: Flags [.], ack 1001, win 3533, options [nop,nop,TS val 204172008 ecr 2175091015], length 0

